{
  "schemaVersion": "1.0",
  "case": {
    "id": "golden-b7",
    "name": "Golden-B7 环件",
    "description": "六道车削工序的历史工程参考；在工作台中以 Demo 会话使用。",
    "partType": "ring",
    "sourceCategory": "engineering_reference",
    "tags": ["车削", "环件", "Golden-B7"]
  },
  "caseVersion": {
    "caseId": "golden-b7",
    "version": "v1"
  },
  "contentDigest": "560cb245471b25bb83fec83a3318969173ed81263edbc8d760f66e9d82ed0dec",
  "processPlan": {
    "id": "golden-b7-plan",
    "name": "Ring_A · Golden-B7 环件示例",
    "partName": "Ring_A.step · 圆环 Ø41 / Ø39 × 5 mm",
    "operations": [
      {
        "id": "ring-facing",
        "sequence": 1,
        "name": "端面车削",
        "source": "Golden-B7 基线离线摘录 · Mock 展示",
        "setup": "共用本任务毛坯、工件零点和装夹信息；原验证记录未完整证明卡盘与夹具条件。",
        "notes": "工步为基线工序和 NC 动作的界面摘要，不是新增加工指令。实际加工仍需完整工艺核对。",
        "steps": [
          {
            "id": "ring-facing-face",
            "sequence": 1,
            "name": "端面车削",
            "description": "按基线端面刀路车削前端面；基线保留前端 +0.1 mm，不作为现场零点已确认的依据。",
            "parameters": []
          }
        ],
        "parameters": [
          {
            "id": "surface-speed",
            "name": "恒线速 G96",
            "value": 295,
            "unit": "m/min",
            "status": "provided",
            "inputKind": "number",
            "description": "Golden-B7 NC 离线记录 · 仅供 Demo 展示",
            "source": "historical_record",
            "editPolicy": "read_only",
            "requirement": "optional"
          },
          {
            "id": "feed-per-rev",
            "name": "每转进给 G99",
            "value": 0.3,
            "unit": "mm/r",
            "status": "provided",
            "inputKind": "number",
            "description": "Golden-B7 NC 离线记录 · 仅供 Demo 展示",
            "source": "historical_record",
            "editPolicy": "read_only",
            "requirement": "optional"
          },
          {
            "id": "spindle-limit",
            "name": "主轴转速上限 G50",
            "value": 3600,
            "unit": "r/min",
            "status": "provided",
            "inputKind": "number",
            "description": "Golden-B7 NC 离线记录 · 仅供 Demo 展示",
            "source": "historical_record",
            "editPolicy": "read_only",
            "requirement": "optional"
          }
        ],
        "resources": [
          {
            "id": "ring-tool-1",
            "name": "T0101 · VNMG 16 04 08",
            "kind": "tool",
            "description": "刀号与刀片名称摘自对应基线 NC；实际装配和可用性待核对。",
            "status": "pending"
          }
        ],
        "onsiteFields": []
      },
      {
        "id": "ring-rough-od",
        "sequence": 2,
        "name": "外圆粗车",
        "source": "Golden-B7 基线离线摘录 · Mock 展示",
        "setup": "共用本任务毛坯、工件零点和装夹信息；原验证记录未完整证明卡盘与夹具条件。",
        "notes": "工步为基线工序和 NC 动作的界面摘要，不是新增加工指令。实际加工仍需完整工艺核对。",
        "steps": [
          {
            "id": "ring-rough-od-rough-od",
            "sequence": 1,
            "name": "外圆粗车",
            "description": "按基线外圆轮廓分层粗车，为后续外圆精车保留余量；具体留量以原工程为准。",
            "parameters": []
          }
        ],
        "parameters": [
          {
            "id": "surface-speed",
            "name": "恒线速 G96",
            "value": 295,
            "unit": "m/min",
            "status": "provided",
            "inputKind": "number",
            "description": "Golden-B7 NC 离线记录 · 仅供 Demo 展示",
            "source": "historical_record",
            "editPolicy": "read_only",
            "requirement": "optional"
          },
          {
            "id": "feed-per-rev",
            "name": "每转进给 G99",
            "value": 0.3,
            "unit": "mm/r",
            "status": "provided",
            "inputKind": "number",
            "description": "Golden-B7 NC 离线记录 · 仅供 Demo 展示",
            "source": "historical_record",
            "editPolicy": "read_only",
            "requirement": "optional"
          },
          {
            "id": "spindle-limit",
            "name": "主轴转速上限 G50",
            "value": 3600,
            "unit": "r/min",
            "status": "provided",
            "inputKind": "number",
            "description": "Golden-B7 NC 离线记录 · 仅供 Demo 展示",
            "source": "historical_record",
            "editPolicy": "read_only",
            "requirement": "optional"
          }
        ],
        "resources": [
          {
            "id": "ring-tool-1",
            "name": "T0101 · VNMG 16 04 08",
            "kind": "tool",
            "description": "刀号与刀片名称摘自对应基线 NC；实际装配和可用性待核对。",
            "status": "pending"
          }
        ],
        "onsiteFields": []
      },
      {
        "id": "ring-finish-od",
        "sequence": 3,
        "name": "外圆精车",
        "source": "Golden-B7 基线离线摘录 · Mock 展示",
        "setup": "共用本任务毛坯、工件零点和装夹信息；原验证记录未完整证明卡盘与夹具条件。",
        "notes": "工步为基线工序和 NC 动作的界面摘要，不是新增加工指令。实际加工仍需完整工艺核对。",
        "steps": [
          {
            "id": "ring-finish-od-finish-od",
            "sequence": 1,
            "name": "外圆精车",
            "description": "按基线外圆精车轮廓加工，参考成品外径为 41 mm。",
            "parameters": []
          }
        ],
        "parameters": [
          {
            "id": "surface-speed",
            "name": "恒线速 G96",
            "value": 295,
            "unit": "m/min",
            "status": "provided",
            "inputKind": "number",
            "description": "Golden-B7 NC 离线记录 · 仅供 Demo 展示",
            "source": "historical_record",
            "editPolicy": "read_only",
            "requirement": "optional"
          },
          {
            "id": "feed-per-rev",
            "name": "每转进给 G99",
            "value": 0.3,
            "unit": "mm/r",
            "status": "provided",
            "inputKind": "number",
            "description": "Golden-B7 NC 离线记录 · 仅供 Demo 展示",
            "source": "historical_record",
            "editPolicy": "read_only",
            "requirement": "optional"
          },
          {
            "id": "spindle-limit",
            "name": "主轴转速上限 G50",
            "value": 3600,
            "unit": "r/min",
            "status": "provided",
            "inputKind": "number",
            "description": "Golden-B7 NC 离线记录 · 仅供 Demo 展示",
            "source": "historical_record",
            "editPolicy": "read_only",
            "requirement": "optional"
          }
        ],
        "resources": [
          {
            "id": "ring-tool-1",
            "name": "T0101 · VNMG 16 04 08",
            "kind": "tool",
            "description": "刀号与刀片名称摘自对应基线 NC；实际装配和可用性待核对。",
            "status": "pending"
          }
        ],
        "onsiteFields": []
      },
      {
        "id": "ring-rough-id",
        "sequence": 4,
        "name": "内孔粗车",
        "source": "Golden-B7 基线离线摘录 · Mock 展示",
        "setup": "共用本任务毛坯、工件零点和装夹信息；原验证记录未完整证明卡盘与夹具条件。",
        "notes": "工步为基线工序和 NC 动作的界面摘要，不是新增加工指令。实际加工仍需完整工艺核对。",
        "steps": [
          {
            "id": "ring-rough-id-rough-id",
            "sequence": 1,
            "name": "内孔粗车",
            "description": "在基线预孔条件下粗车内孔，为后续内孔精车保留余量；不是钻孔工序。",
            "parameters": []
          }
        ],
        "parameters": [
          {
            "id": "surface-speed",
            "name": "恒线速 G96",
            "value": 330,
            "unit": "m/min",
            "status": "provided",
            "inputKind": "number",
            "description": "Golden-B7 NC 离线记录 · 仅供 Demo 展示",
            "source": "historical_record",
            "editPolicy": "read_only",
            "requirement": "optional"
          },
          {
            "id": "feed-per-rev",
            "name": "每转进给 G99",
            "value": 0.1,
            "unit": "mm/r",
            "status": "provided",
            "inputKind": "number",
            "description": "Golden-B7 NC 离线记录 · 仅供 Demo 展示",
            "source": "historical_record",
            "editPolicy": "read_only",
            "requirement": "optional"
          },
          {
            "id": "spindle-limit",
            "name": "主轴转速上限 G50",
            "value": 3600,
            "unit": "r/min",
            "status": "provided",
            "inputKind": "number",
            "description": "Golden-B7 NC 离线记录 · 仅供 Demo 展示",
            "source": "historical_record",
            "editPolicy": "read_only",
            "requirement": "optional"
          }
        ],
        "resources": [
          {
            "id": "ring-tool-2",
            "name": "T0202 · CCMT 09 T3 04",
            "kind": "tool",
            "description": "刀号与刀片名称摘自对应基线 NC；实际装配和可用性待核对。",
            "status": "pending"
          }
        ],
        "onsiteFields": []
      },
      {
        "id": "ring-finish-id",
        "sequence": 5,
        "name": "内孔精车",
        "source": "Golden-B7 基线离线摘录 · Mock 展示",
        "setup": "共用本任务毛坯、工件零点和装夹信息；原验证记录未完整证明卡盘与夹具条件。",
        "notes": "工步为基线工序和 NC 动作的界面摘要，不是新增加工指令。实际加工仍需完整工艺核对。",
        "steps": [
          {
            "id": "ring-finish-id-finish-id",
            "sequence": 1,
            "name": "内孔精车",
            "description": "按基线内孔精车轮廓加工，参考成品内径为 39 mm。",
            "parameters": []
          }
        ],
        "parameters": [
          {
            "id": "surface-speed",
            "name": "恒线速 G96",
            "value": 330,
            "unit": "m/min",
            "status": "provided",
            "inputKind": "number",
            "description": "Golden-B7 NC 离线记录 · 仅供 Demo 展示",
            "source": "historical_record",
            "editPolicy": "read_only",
            "requirement": "optional"
          },
          {
            "id": "feed-per-rev",
            "name": "每转进给 G99",
            "value": 0.1,
            "unit": "mm/r",
            "status": "provided",
            "inputKind": "number",
            "description": "Golden-B7 NC 离线记录 · 仅供 Demo 展示",
            "source": "historical_record",
            "editPolicy": "read_only",
            "requirement": "optional"
          },
          {
            "id": "spindle-limit",